PublicationDate;Summary;Title;Epidemiology;Assessment;Overview;DonId
2024-10-18T09:59:40Z;As of 17 October 2024, a total of 62 Marburg virus disease cases, including 15 deaths (CFR: 24.2%), have been reported in Rwanda, with forty-three recoveries. Contact tracing is underway, with over 800 contacts under follow-up as of 14 October 2024. In October, a surge team from WHO was deployed to support the in-country response across the functions of incident management: epidemiology, health operations, case management, health logistics, vaccines research, partner coordination and infection prevention and control.;Marburg virus disease – Rwanda;MVD is a highly virulent disease that can cause haemorrhagic fever and is clinically similar to Ebola virus disease. Marburg and Ebola viruses are both members of the Filoviridae family (filovirus). People are infected with Marburg virus when they come into close contact with Rousettus bats, a type of fruit bat, that can carry the Marburg virus and are often found in mines or caves. Marburg virus then spreads between people via direct contact (through broken skin or mucous membranes) with the blood, secretions, organs or other bodily fluids of infected people, and with surfaces and materials (e.g. bedding, clothing) contaminated with these fluids. Health workers have previously been infected while treating patients with suspected or confirmed MVD. Burial ceremonies that involve direct contact with the body of the deceased can also contribute to the transmission of Marburg virus.The incubation period varies from two to 21 days. Illness caused by Marburg virus begins abruptly, with high fever, severe headache and severe malaise. Severe watery diarrhoea, abdominal pain and cramping, nausea and vomiting can begin on the third day. Although not all cases present with haemorrhagic signs, severe haemorrhagic manifestations may appear between five and seven days from symptoms onset, and fatal cases usually have some form of bleeding, often from multiple areas. In fatal cases, death occurs most often between eight and nine days after symptom onset, usually preceded by severe blood loss and shock. There is currently no approved treatment or vaccine for MVD. Some candidate vaccines and therapeutics are currently under investigation.Seventeen outbreaks of MVD have previously been reported globally. The most recent outbreaks were reported in Equatorial Guinea and the United Republic of Tanzania between February and June 2023. Additional countries that previously reported outbreaks of MVD in the African Region include Angola, the Democratic Republic of the Congo, Ghana, Guinea, Kenya, South Africa, and Uganda.;Marburg virus disease (MVD) is caused by the same family of viruses (Filoviridae) that causes Ebola virus disease. MVD is an epidemic-prone disease associated with high CFR (24-88%). In the early course of the disease, MVD is challenging to distinguish from other infectious diseases such as malaria, typhoid fever, shigellosis, meningitis and other viral haemorrhagic fevers. Epidemiologic features can help differentiate between viral hemorrhagic fevers (including history of exposure to bats, caves, or mining) and laboratory testing is important to confirm the diagnosis. With 62 confirmed cases reported, this is the third largest MVD outbreak reported, with the majority of confirmed cases reported among healthcare workers. Healthcare-associated infections (also known as nosocomial infections) of this disease can lead to further spread if not controlled early. The importance of screening all persons entering health facilities as well as inpatient surveillance for prompt identification, isolation, and notification cannot be overemphasized. This is in addition to the importance of contact identification and monitoring of all probable and confirmed cases. The source of the outbreak, the likely date of onset of the first case and additional epidemiological information on cases are still pending further outbreak investigation.  On 30 September WHO assessed the risk of this outbreak as very high at the national level, high at the regional level, and low at the global level. However, based on the evolution of the outbreak and ongoing investigations, this risk assessment may be revised. MVD is not easily transmissible (i.e. in most instances it requires contact with the body fluids of a sick patient presenting with symptoms or with surfaces contaminated with these fluids). In addition, there are ongoing public health measures in place, including active surveillance in facilities and communities, testing suspected cases, isolation and treatment of cases and contact tracing.;Since the last Disease Outbreak News on this event was published on 11 October 2024, four additional laboratory-confirmed cases of Marburg virus disease (MVD) have been reported in Rwanda. As of 17 October 2024, a total of 62 cases, including 15 deaths (CFR: 24.2%), have been reported. Most of the cases have been reported from the three districts in Kigali city. Since the declaration of the outbreak on 27 September and as of 17 October, 43 confirmed cases have recovered, the remaining four cases are under care at the designated Marburg treatment center. Health workers from two health facilities in Kigali account for over 80% of confirmed cases. All new confirmed cases reported within the past week, have been associated with the two hospital clusters in Kigali. As of 17 October 2024, a total of 4486 tests for Marburg virus have been conducted, with approximately 200-300 samples being tested daily at the Rwanda Biomedical Center. Contact tracing is underway, with over 800 contacts under follow-up as of 14 October 2024. Both contacts who travelled internationally, to Belgium and Germany, have completed the 21 days follow-up period and no longer pose a public health risk. The source of the outbreak is still under investigation and additional information will be provided when available.;2024-DON540
2024-10-11T10:42:52Z;As of 10 October 2024, a total of 58 cases of Marburg virus disease (MVD), including 13 deaths (case fatality ratio (CFR): 22%), have been reported in Rwanda. Fifteen recoveries have been reported among the confirmed cases as of 10 October 2024. Contact tracing is underway, with over 700 contacts under follow-up as of 9 October 2024. WHO classified the outbreak as a grade 3 emergency, the highest internal level for emergencies based on the WHO Emergency Response Framework and a surge team from WHO has travelled to support the in-country response across the functions of incident management: epidemiology, health operations, case management, health logistics, vaccines research, partner coordination and infection prevention and control.;Marburg virus disease – Rwanda;MVD is a highly virulent disease that can cause haemorrhagic fever and is clinically similar to Ebola virus disease. Marburg and Ebola viruses are both members of the Filoviridae family (filovirus). People are infected with Marburg virus when they come into close contact with Rousettus bats, a type of fruit bat, that can carry the Marburg virus and are often found in mines or caves. Marburg virus then spreads between people via direct contact (through broken skin or mucous membranes) with the blood, secretions, organs or other bodily fluids of infected people, and with surfaces and materials (e.g. bedding, clothing) contaminated with these fluids. Health workers have previously been infected while treating patients with suspected or confirmed MVD. Burial ceremonies that involve direct contact with the body of the deceased can also contribute to the transmission of Marburg virus.The incubation period varies from two to 21 days. Illness caused by Marburg virus begins abruptly, with high fever, severe headache and severe malaise. Severe watery diarrhoea, abdominal pain and cramping, nausea and vomiting can begin on the third day. Although not all cases present with haemorrhagic signs, severe haemorrhagic manifestations may appear between five and seven days from symptoms onset, and fatal cases usually have some form of bleeding, often from multiple areas. In fatal cases, death occurs most often between eight and nine days after symptom onset, usually preceded by severe blood loss and shock. There is currently no approved treatment or vaccine for MVD. Some candidate vaccines and therapeutics are currently under investigation.Several outbreaks of MVD have previously been reported from countries neighbouring Rwanda, including the Democratic Republic of the Congo, Uganda and the United Republic of Tanzania. The most recent outbreaks were reported in Equatorial Guinea and the United Republic of Tanzania between February and June 2023. The affected region in the United Republic of Tanzania was the Kagera region, which borders Rwanda. Additional countries that previously reported outbreaks of MVD in the African Region included Angola, Ghana, Guinea, Kenya, and South Africa.;Marburg virus disease (MVD) is caused by the same family of viruses (Filoviridae) that causes Ebola virus disease. MVD is an epidemic-prone disease associated with high CFR (24-88%). In the early course of the disease, MVD is challenging to distinguish from other infectious diseases such as malaria, typhoid fever, shigellosis, meningitis and other viral haemorrhagic fevers. Epidemiologic features can help differentiate between viral hemorrhagic fevers (including history of exposure to bats, caves, or mining) and laboratory testing is important to confirm the diagnosis. The notification of 58 confirmed cases, of which over 80% are healthcare workers from two different health facilities in the country is of great concern. Healthcare-associated infections (also known as nosocomial infections) of this disease can lead to further spread if not controlled early. The importance of screening all persons entering health facilities as well as inpatient surveillance for prompt identification, isolation, and notification cannot be overemphasized. This is in addition to the importance of contact identification and monitoring of all probable and confirmed cases. The source of the outbreak, the likely date of onset of the first case and additional epidemiological information on cases are still pending further outbreak investigation. On 30 September WHO assessed the risk of this outbreak as very high at the national level, high at the regional level, and low at the global level. However, based on the evolution of the outbreak and ongoing investigations, this risk assessment may be revised. MVD is not easily transmissible (i.e. in most instances it requires contact with the body fluids of a sick patient presenting with symptoms or with surfaces contaminated with these fluids). In addition, there are ongoing public health measures in place, including active surveillance in facilities and communities, testing suspected cases, contact tracing, isolation and treatment of cases.;Since the first Disease Outbreak News on this event was published on 30 September 2024, 32 additional laboratory-confirmed cases of Marburg virus disease (MVD)have been reported in Rwanda. As of 10 October 2024, a total of 58 cases, including 13 deaths (CFR: 22%), have been reported. The vast majority of the cases have been reported from the three districts within Kigali. Since the declaration of the outbreak on 27 September and as of 10 October, 15 confirmed cases have recovered, the remaining 30 cases are under care at the designated Marburg treatment center. Health workers from two health facilities in Kigali account for over 80% of confirmed cases. All new confirmed cases reported within the past week, have been associated with the two hospital clusters in Kigali. As of 10 October 2024, a total of 2949 tests for Marburg virus have been conducted, with approximately 200-300 samples being tested daily at the Rwanda Biomedical Center from suspected MVD cases. Contact tracing is underway, with over 700 contacts under follow-up as of 9 October 2024. A contact is known to have travelled internationally, to Germany, and is currently being monitored by the local health authorities for the recommended 21 days follow-up period. A contact who travelled to Belgium has completed the 21 days follow-up period and no longer poses a public health risk. The source of the outbreak is still under investigation and additional information will be provided when available.;2024-DON539
2024-10-03T15:54:58Z;On 13 September 2024, the International Health Regulations (IHR) National Focal Point (NFP) for Barbados notified the World Health Organization (WHO) of a confirmed human infection with West Nile Virus (WNV) in a child.WNV is generally carried by migratory birds and transmitted locally by mosquitoes to humans, horses and other mammals. WNV infection in humans generally causes mild disease, but there can be neurological symptoms and, in some cases, it can be fatal.This is the first human case of WNV infection detected in Barbados. Additionally, no infections have been previously documented in birds or horses in this country, making this case both unusual and unexpected. However, the WNV has spread throughout the Caribbean, likely via infected migratory birds. It is possible that the virus is circulating in birds and horses undetected. Despite this, the overall impact on public health remains limited at this stage, as there is currently only one recorded human case and appropriate public health response measures have been implemented. WHO considers the current risk from WNV as low but will continue to evaluate the epidemiological situation in Barbados.;West Nile virus- Barbados;The WNV primarily infects humans through the bites of infected mosquitoes but can also be transmitted through human-origin health products (blood transfusion, organ transplant, etc.). The virus is generally carried by migratory birds and transmitted locally by mosquitoes to humans, horses and other mammals. It is important to note that horses and humans cannot transmit the virus to new mosquitoes. WNV infection in humans usually causes mild disease, with approximately 80% of those infected being asymptomatic. The incubation period is usually 3 to 14 days. About 20% of people who become infected with WNV will develop West Nile fever. Symptoms include fever, headache, tiredness, and body aches, nausea, vomiting, occasionally with a skin rash (on the trunk of the body) and swollen lymph glands. It is estimated that approximately 1 in 150 persons infected with the WNV will develop a more severe form of disease. The symptoms of severe disease (also called neuroinvasive disease, such as West Nile encephalitis or meningitis or West Nile poliomyelitis) include headache, high fever, neck stiffness, stupor, disorientation, coma, tremors, convulsions, muscle weakness, and paralysis. Serious illness can occur in people of any age, however, people over the age of 50 and some immunocompromised persons (for example, transplant patients) are at the highest risk of getting severely ill when infected with WNV. No vaccine currently exists for humans. This is the first human case of WNV infection detected in Barbados. Additionally, no infections have been previously documented in birds or horses in this country, making this case both unusual and unexpected. However, the WNV has spread throughout the Caribbean, likely via infected migratory birds. A quantitative risk assessment of the introduction of WNV into Barbados, conducted in 2007, highlighted that the presence of migratory birds and mosquitoes posed an imminent threat to the virus's introduction.;Althoughno cases of WNV have been documented in birds or horses in the country, it ispossible that the virus is circulating in these populations undetected. Despitethis, the overall impact on public health remains limited at this stage, asthere is currently only one recorded human case and appropriate public healthresponse measures have been implemented, as described above. Therisk of international dissemination of WNV from Barbados is low. The virus isprimarily transmitted through mosquito bites, with birds as the natural hosts.There is no evidence to suggest that WNV spreads easily between humans or fromhorses to mosquitoes. Therefore, the potential for widespread internationaltransmission remains low. Basedon these criteria, the overall risk related to the public health remains low.WHO will continue to evaluate the epidemiological situation in Barbados.;On 13 September 2024, the IHR NFP for Barbados notified WHO of one confirmed human infection with WNV, in a child. This marks the first detected human case of WNV reported from Barbados.On 10 June, the patient reported the onset of symptoms including headache, fever, vomiting, neck pain and painful knees, and visited a private clinic on 14 June. A test for dengue conducted on the same day was negative.The patient was hospitalized at the Pediatric Intensive Care Unit (PICU) of a hospital on 16 June due to worsening of signs and symptoms, including joint pain, abdominal pain, altered mental status, and slurred speech. Cerebrospinal fluid analysis returned negative results for some bacterial and viral pathogens. Despite treatment, the patients condition worsened.On 3 September 2024, blood samples were collected and sent to the Mayo Clinic in the United States of America for WNV testing. The presence of West Nile virus antibodies (IgG) was confirmed on 4 September 2024. The patient is still under care and recovering.The patient reported visiting a horse stable in February 2024 and a beach frequented by horses on 8 June 2024, two days before symptom onset. Although these exposures to horses were considered risk factors for WNV infection, the precise source of infection remains unspecified. No other suspected cases of WNV were identified, but public health authorities continue to monitor the situation closely.;2024-DON538
